recipe_name,recipe_cuisine_name,tip
Tavë Kosi,Albanian,Ensure the lamb is tender before adding the yogurt mixture.
Tavë Kosi,Albanian,Serve with a side of fresh salad to balance the richness of the dish.
Tavë Kosi,Albanian,Can substitute lamb with chicken for a different flavor.
Bakllasarem,Albanian,Cut the pastry before baking to make serving easier.
Bakllasarem,Albanian,Ensure the syrup is hot when poured over the cooled pastry to absorb properly.
Bakllasarem,Albanian,Can add clove or cardamom to the syrup for extra flavor.
Fërgesë,Albanian,Add chili flakes for a spicy kick.
Fërgesë,Albanian,"Can be made ahead and reheated, enhancing the flavors."
Fërgesë,Albanian,Perfect as a vegetarian main course.
Speca të mbushur,Albanian,Ensure the rice is not overcooked as it will bake further in the oven.
Speca të mbushur,Albanian,Can use a mix of seafood like shrimp and scallops.
Speca të mbushur,Albanian,Top with cheese for the last 10 minutes of baking for a melty crust.
Byrek me Spinaq,Albanian,Keep the phyllo dough covered with a damp towel while working to prevent it from drying out.
Byrek me Spinaq,Albanian,Add onions to the spinach mixture for extra flavor.
Byrek me Spinaq,Albanian,Serve with yogurt for breakfast or a light lunch.
Jani me fasule,Albanian,Check water level during cooking and add more if needed to prevent sticking.
Jani me fasule,Albanian,Can be served with pickled vegetables for added flavor.
Jani me fasule,Albanian,Leftovers taste even better the next day as flavors meld.
Shëndetli,Albanian,Do not underbake the cake; ensure it is fully set to absorb the syrup.
Shëndetli,Albanian,Pierce the cake with a fork before pouring syrup to enhance absorption.
Shëndetli,Albanian,Serve with a dollop of whipped cream or vanilla ice cream.
Qifqi,Albanian,Use short-grain rice for better stickiness and forming.
Qifqi,Albanian,Add finely chopped onions to the rice mixture for extra flavor.
Qifqi,Albanian,Serve with plain yogurt or tzatziki for dipping.
Përime në zgare,Albanian,Ensure the grill is very hot before adding vegetables to get good sear marks.
Përime në zgare,Albanian,Can be served as a side dish or as a vegetarian main course.
Përime në zgare,Albanian,Drizzle with balsamic vinegar before serving for added flavor.
Mish me midhje,Albanian,Always use fresh mussels for the best flavor.
Mish me midhje,Albanian,Discard any mussels that do not open after cooking.
Mish me midhje,Albanian,Add a pinch of chili flakes for a spicy version.
Cheeseburger,American,Do not press down on the patties while grilling to keep the juices inside.
Cheeseburger,American,"For extra flavor, add a slice of bacon on top of the cheese."
Cheeseburger,American,Use high-quality meat with a bit of fat for juicier patties.
Apple Pie,American,"Keep all ingredients, especially the butter and water, cold when making the crust."
Apple Pie,American,Let the pie cool for at least 20 minutes after baking to set the filling.
Apple Pie,American,Sprinkle a little sugar on top of the crust before baking for a sweet crunch.
Fried Chicken,American,Keep the oil temperature consistent for the best results.
Fried Chicken,American,Add a bit of hot sauce to the egg wash for a spicy kick.
Fried Chicken,American,Let the chicken rest for a few minutes after frying for extra crispiness.
Macaroni and Cheese,American,"For extra creamy macaroni, add a dollop of cream cheese to the sauce."
Macaroni and Cheese,American,Use a mix of different cheeses for more depth of flavor.
Macaroni and Cheese,American,Add cooked bacon or ham for a heartier dish.
Barbecue Ribs,American,Let the ribs marinate with the dry rub overnight for deeper flavor.
Barbecue Ribs,American,Keep a water pan in the grill to maintain moisture during the final grilling.
Barbecue Ribs,American,Apply multiple layers of barbecue sauce for a richer flavor.
Pancakes,American,Do not overmix the batter to keep pancakes fluffy.
Pancakes,American,Add blueberries or chocolate chips to the batter for variety.
Pancakes,American,Test griddle temperature with a small amount of batter; it should sizzle.
Chocolate Chip Cookies,American,Chill the dough for 30 minutes before baking to prevent spreading.
Chocolate Chip Cookies,American,"Use a combination of chocolate chip types (milk, dark, white) for extra flavor."
Chocolate Chip Cookies,American,Store cookies in an airtight container to keep them soft.
BLT Sandwich,American,Add a slice of avocado or a fried egg to elevate this classic sandwich.
BLT Sandwich,American,Use thick-cut bacon for more texture and flavor.
BLT Sandwich,American,Toast the bread lightly to keep it from getting soggy from the tomato.
Clam Chowder,American,Do not let the chowder boil after adding the cream to prevent curdling.
Clam Chowder,American,"For a thicker chowder, mash some of the potatoes slightly before adding the cream."
Clam Chowder,American,Enhance the flavor by adding a bay leaf during simmering.
Brownies,American,Do not overmix the batter to keep the brownies fudgy.
Brownies,American,Add nuts like walnuts or pecans for a crunchy texture.
Brownies,American,Serve warm with a scoop of ice cream for a decadent dessert.
Shopska Salata,Bulgarian,Chill the vegetables before preparing for a refreshing starter.
Shopska Salata,Bulgarian,Serve alongside a loaf of crusty bread.
Shopska Salata,Bulgarian,Add roasted red peppers for additional flavor and color.
Kavarma,Bulgarian,Serve with a side of Bulgarian bread or over cooked rice.
Kavarma,Bulgarian,Adjust the amount of paprika to taste for a spicier version.
Kavarma,Bulgarian,"Can be made ahead and reheated, as it tastes even better the next day."
Banitsa,Bulgarian,Keep phyllo dough covered with a damp towel to prevent drying out.
Banitsa,Bulgarian,Serve with plain yogurt or a hot drink for a traditional breakfast.
Banitsa,Bulgarian,Add spinach or leeks to the filling for a variation.
Mekitsa,Bulgarian,Do not overcrowd the fryer to maintain a consistent temperature.
Mekitsa,Bulgarian,Serve immediately while hot for the best texture.
Mekitsa,Bulgarian,Experiment with savory versions by adding cheese or garlic to the dough.
Musaka,Bulgarian,Let the musaka sit for 10-15 minutes after baking to firm up for easier serving.
Musaka,Bulgarian,Add a layer of sautéed onions and carrots for extra flavor and moisture.
Musaka,Bulgarian,Serve with a side salad of cucumbers and tomatoes.
Tarator,Bulgarian,Serve very cold for a refreshing summer dish.
Tarator,Bulgarian,Add ice cubes just before serving to keep it chilled.
Tarator,Bulgarian,Experiment with adding other herbs like mint for a different flavor profile.
Kadaif,Bulgarian,Ensure the syrup is hot when poured over to soak the kadaif thoroughly.
Kadaif,Bulgarian,Allow the kadaif to sit for several hours to fully absorb the syrup and enhance the flavors.
Kadaif,Bulgarian,Serve with a dollop of whipped cream or a scoop of ice cream.
Bulgarian Cheese Toast,Bulgarian,Serve with a side of tomato slices or olives.
Bulgarian Cheese Toast,Bulgarian,"For extra flavor, add a sprinkle of paprika or black pepper on the cheese before broiling."
Bulgarian Cheese Toast,Bulgarian,Ensure the bread is toasted first to prevent it from becoming soggy.
Garash Cake,Bulgarian,Make sure each sponge layer is cooled before applying ganache.
Garash Cake,Bulgarian,"If the ganache is too runny, chill it before spreading on the cake layers."
Garash Cake,Bulgarian,Decorate with walnut pieces or chocolate shavings for an elegant finish.
Sarmi,Bulgarian,Ensure the cabbage leaves are not ripped to prevent filling from leaking out.
Sarmi,Bulgarian,Add a bit of smoked meat to the pot for a deeper flavor.
Sarmi,Bulgarian,Serve with a dollop of yogurt or sour cream.
Beef Stroganoff,Russian,Use high-quality beef for the best texture.
Beef Stroganoff,Russian,Do not let the sour cream boil to prevent curdling.
Beef Stroganoff,Russian,Serve with a side of pickles for an authentic Russian experience.
Medovik,Russian,Ensure each layer is evenly rolled to cook uniformly.
Medovik,Russian,"The cake tastes better after it soaks overnight, plan accordingly."
Medovik,Russian,Use a serrated knife for easier slicing of the soft layers.
Borscht,Russian,Adjust the amount of vinegar and sugar to balance the sweetness and acidity.
Borscht,Russian,Can be served with a slice of rye bread.
Borscht,Russian,Add a beef bone to the pot for extra flavor.
Pelmeni,Russian,Make sure to seal the dumplings well to prevent them from opening while boiling.
Pelmeni,Russian,Pelmeni can be frozen for future use before boiling.
Pelmeni,Russian,Serve with vinegar or mustard for added flavor.
Syrniki,Russian,Ensure the tvorog is well-drained to make the patties easier to form.
Syrniki,Russian,Adjust the amount of flour to achieve the desired thickness.
Syrniki,Russian,Try different jams as toppings for variety.
Kasha,Russian,"For a richer flavor, toast the groats in a dry pan before boiling."
Kasha,Russian,Can be served with sautéed onions for added taste.
Kasha,Russian,Excellent base for adding vegetables or meat for a heartier meal.
Pryaniki,Russian,Allow the dough to rest before rolling for easier handling.
Pryaniki,Russian,Adjust spice amounts to taste.
Pryaniki,Russian,The icing sets better if cookies are completely cool.
Zefir,Russian,Use a silicone mat for easier removal after drying.
Zefir,Russian,Experiment with different fruit purées for variety.
Zefir,Russian,Ensure the mixture is very stiff before piping to maintain shape.
Olivier Salad,Russian,Dice all ingredients to the same size for a uniform texture.
Olivier Salad,Russian,Can be made a day ahead to enhance the flavors.
Olivier Salad,Russian,Add a little mustard to the mayonnaise for extra zest.
Shchi,Russian,Using a mix of pork and beef can enhance the flavor.
Shchi,Russian,Serve with rye bread for an authentic Russian meal.
Shchi,Russian,Add a splash of vinegar or lemon juice for added zest.
